{"run":42,"commit":"9891464","metric":950.03,"metrics":{"bm25_query_ms":103.742,"bm25_index_ms":493.199,"result_format_ms":106.534,"summary_ms":108.603,"checksum":3107063},"status":"discard","description":"use default array sort for MCP server summary names","timestamp":1777538199705,"segment":1,"confidence":32.83315990527717,"asi":{"hypothesis":"MCP server names are generally ASCII identifiers, so default Array.sort() might avoid localeCompare callback overhead in summary generation while preserving order for typical server names.","observed_effect":"Primary regressed severely to 950.03ms and summary_ms worsened to 108.603ms; checksum unchanged for the benchmark names.","rollback_reason":"Default sort did not improve and broad phase timings worsened. Also, changing locale ordering semantics is not worth it without a clear win.","next_action_hint":"Keep localeCompare in summary sorting. Avoid sort-comparator micro-optimizations under this noisy workload."}}
{"run":43,"commit":"9891464","metric":300.245,"metrics":{"bm25_query_ms":39.002,"bm25_index_ms":176.738,"result_format_ms":47.047,"summary_ms":37.723,"checksum":3107063},"status":"discard","description":"derive BM25 query document frequency from postings length when available","timestamp":1777538302355,"segment":1,"confidence":33.56641903402064,"asi":{"hypothesis":"For indexes with postings, postings.length already equals document frequency for a token; using it during query-term weighting should avoid an extra documentFrequencies Map lookup per query token while preserving fallback indexes without postings.","observed_effect":"Primary measured 300.245ms, worse than best 289.682ms. Query/formatting stayed close but did not improve enough; checksum unchanged.","rollback_reason":"No primary improvement; optional postings lookup before document-frequency lookup did not beat the existing query-term construction under the full workload.","next_action_hint":"Keep the current Map-based document frequency lookup. Further query-term micro-optimizations are near or below noise; prefer new workload or tests."}}
{"run":44,"commit":"9891464","metric":492.497,"metrics":{"bm25_query_ms":62.08,"bm25_index_ms":312.688,"result_format_ms":74.371,"summary_ms":52.326,"checksum":3107063},"status":"discard","description":"precompute query-independent BM25 score factor on each posting","timestamp":1777538443993,"segment":1,"confidence":32.83315990527717,"asi":{"hypothesis":"The term-frequency saturation component tf/(tf + normalization) is independent of the query, so precomputing it on each posting should reduce repeated scoring arithmetic across many searches.","observed_effect":"Primary regressed to 492.497ms. Query and formatting worsened, and bm25_index_ms increased substantially from extra per-posting computation/object size. Checksum unchanged, so scoring semantics were preserved.","rollback_reason":"Larger posting objects and optional scoreFactor branching outweighed the saved arithmetic. Similar to prior posting-size experiments, compact postings are better for this workload.","next_action_hint":"Do not add per-posting derived fields. If scoring arithmetic is revisited, prefer per-document or vectorized data that does not bloat every posting."}}
{"run":45,"commit":"9891464","metric":1015.444,"metrics":{"bm25_query_ms":77.469,"bm25_index_ms":661.894,"result_format_ms":107.271,"summary_ms":86.413,"checksum":3107063},"status":"discard","description":"inline bounded top-k insertion in BM25 search loops","timestamp":1777538507430,"segment":1,"confidence":31.21256457782861,"asi":{"hypothesis":"Inlining the small pushResult closure into postings and fallback result loops should avoid closure calls and improve hot-path top-k insertion overhead.","observed_effect":"Primary regressed severely to 1015.444ms, with unexpectedly high bm25_index_ms and slower query/formatting. Checksum unchanged.","rollback_reason":"Inlining duplicated code hurt runtime behavior and maintainability without a win; likely larger function body or JIT effects outweighed closure-call savings.","next_action_hint":"Keep the pushResult closure. Avoid top-k insertion micro-edits unless accompanied by a focused benchmark and clear semantic tests."}}
