{"type":"config","name":"coding-agent latency and responsiveness","metricName":"total_ms","metricUnit":"ms","bestDirection":"lower"}
{"run":1,"commit":"7e2f56a","metric":0,"metrics":{"bm25_query_ms":0,"bm25_index_ms":0,"file_search_ms":0,"bash_render_ms":0,"tool_discovery_render_ms":0},"status":"crash","description":"baseline failed because autoresearch runner could not spawn bash for ./autoresearch.sh","timestamp":1777534866815,"segment":0,"confidence":null,"asi":{"hypothesis":"Initial benchmark harness using a bash wrapper would establish baseline metrics for agent latency phases.","error":"run_experiment reported spawn bash ENOENT before executing ./autoresearch.sh.","rollback_reason":"Benchmark did not start; likely Windows environment lacks bash for run_experiment command wrapper or script shebang.","next_action_hint":"Switch autoresearch command to a direct Bun invocation or provide a Windows-compatible runner so run_experiment does not depend on bash."}}
{"run":2,"commit":"7e2f56a","metric":0,"metrics":{"bm25_query_ms":0,"bm25_index_ms":0,"file_search_ms":0,"bash_render_ms":0,"tool_discovery_render_ms":0},"status":"crash","description":"baseline failed loading pi-natives native module under Windows Bun","timestamp":1777535097848,"segment":0,"confidence":null,"asi":{"hypothesis":"After making bash available to run_experiment, the benchmark would execute and produce baseline latency metrics.","error":"Bun could not resolve pi_natives.win32-x64.node from packages/natives/native/index.js; suggested rebuild or reinstall @oh-my-pi/pi-natives.","rollback_reason":"Benchmark process exited before metrics due missing native binding.","next_action_hint":"Avoid pi-natives-dependent imports in the benchmark or build packages/natives; easiest is to remove SearchTool/native grep and renderer imports that transitively load sanitizeText/pi-natives from the benchmark."}}
{"type":"config","name":"coding-agent MCP tool-discovery latency","metricName":"total_ms","metricUnit":"ms","bestDirection":"lower"}
{"run":3,"commit":"79a5b8b","metric":5038.424,"metrics":{"bm25_query_ms":2150.963,"bm25_index_ms":240.614,"result_format_ms":1571.128,"summary_ms":95.154,"checksum":3107063},"status":"keep","description":"baseline for native-independent MCP tool-discovery latency workload","timestamp":1777535382782,"segment":1,"confidence":null,"asi":{"hypothesis":"Establish a stable baseline for pure MCP tool-discovery search, result formatting, and server summary latency before optimizing ranking algorithms.","environment_note":"run_experiment required a bash.exe shim in the user agent bin path on Windows; benchmark emits warnings about missing /tmp but completes successfully.","bottleneck_hint":"BM25 query time and repeated result formatting dominate the workload; both call searchDiscoverableMCPTools many times, so avoiding full sort/allocation for top-k should be promising."}}
{"run":4,"commit":"77ed325","metric":3591.837,"metrics":{"bm25_query_ms":1446.829,"bm25_index_ms":218.882,"result_format_ms":1738.819,"summary_ms":87.983,"checksum":3107063},"status":"keep","description":"use bounded top-k BM25 ranking and filter selected MCP tools during search","timestamp":1777535572458,"segment":1,"confidence":null,"asi":{"hypothesis":"For small result limits, keeping only the best k BM25 matches while scanning avoids allocating, sorting, and slicing every positive document; SearchToolBm25 can pass selected tools as an exclusion set instead of ranking the entire corpus first.","observed_effect":"Primary improved ~28.7%; bm25_query_ms dropped strongly while result_format_ms rose slightly because that phase performs more repeated searches and noise shifted work distribution.","semantic_contract":"Ranking order remains score descending with tool-name ascending tie-break; checksum unchanged, suggesting result set stability for benchmark queries.","next_action_hint":"Profile index build and tokenization next; repeated Array.from/reduce and tokenize regex passes may be reducible."}}
{"run":5,"commit":"201e3ca","metric":3291.248,"metrics":{"bm25_query_ms":1266.842,"bm25_index_ms":220.678,"result_format_ms":1699.047,"summary_ms":100.192,"checksum":3107063},"status":"keep","description":"track BM25 document length while tokenizing instead of reducing map values","timestamp":1777535646106,"segment":1,"confidence":5.812508109079175,"asi":{"hypothesis":"Avoiding Array.from(termFrequencies.values()).reduce during index construction should reduce per-document allocation and index-build latency without changing weighted length semantics.","observed_effect":"Primary improved further to 3291ms; bm25_index_ms was roughly flat/noisy, but query and formatting phases also improved with unchanged checksum.","semantic_contract":"Document length still equals the sum of weighted token occurrences because addWeightedTokens increments length by weight for every token occurrence.","next_action_hint":"Consider manual tokenization or precomputed query statistics; regex tokenize still allocates multiple intermediate strings per field/query."}}
{"run":6,"commit":"201e3ca","metric":3669.302,"metrics":{"bm25_query_ms":1599.14,"bm25_index_ms":281.115,"result_format_ms":1902.88,"summary_ms":82.088,"checksum":3107063},"status":"discard","description":"replace regex tokenization with manual ASCII scanner","timestamp":1777535733076,"segment":1,"confidence":9.242997032170004,"asi":{"hypothesis":"Manual ASCII tokenization would avoid regex replace/split allocations and speed query/index phases while preserving camelCase and non-alphanumeric splitting semantics.","observed_effect":"Primary regressed from 3291ms to 3669ms; bm25_query_ms, bm25_index_ms, and result_format_ms all worsened despite unchanged checksum.","rollback_reason":"Manual scanner used per-character string concatenation and a closure, which is slower than Bun's optimized regex/string pipeline for this workload.","next_action_hint":"Do not retry this manual tokenizer shape; if revisiting tokenization, try caching tokenized queries or field tokens rather than hand-scanning strings."}}
{"run":7,"commit":"201e3ca","metric":5695.84,"metrics":{"bm25_query_ms":1924.014,"bm25_index_ms":292.324,"result_format_ms":2687.738,"summary_ms":131.528,"checksum":3107063},"status":"discard","description":"precompute BM25 document normalization in the search index","timestamp":1777535842819,"segment":1,"confidence":4.621498516085002,"asi":{"hypothesis":"Precomputing per-document BM25 length normalization during index build would avoid repeated arithmetic in query scoring.","observed_effect":"Primary regressed badly to 5696ms and all major phases worsened, likely due optional property/shape changes on search documents and extra index-build writes.","rollback_reason":"Optimization made hot document objects slower despite removing arithmetic; checksum unchanged but latency worse.","next_action_hint":"Avoid adding optional hot-path fields to DiscoverableMCPSearchDocument. If precomputing, consider a parallel numeric array benchmarked carefully, but focus first on algorithmic scoring/skipping."}}
{"run":8,"commit":"201e3ca","metric":5295.043,"metrics":{"bm25_query_ms":2152.05,"bm25_index_ms":214.905,"result_format_ms":2771.343,"summary_ms":153.2,"checksum":3107063},"status":"discard","description":"avoid redundant Set allocation when computing document frequencies","timestamp":1777535924571,"segment":1,"confidence":2.0516320398119783,"asi":{"hypothesis":"Because termFrequencies is already a Map with unique keys, iterating keys directly should avoid per-document Set allocation during index build.","observed_effect":"bm25_index_ms improved slightly, but primary regressed heavily due much slower query/result-format phases in the noisy full workload.","rollback_reason":"Primary metric worsened; small index-build gain did not justify overall regression/noise risk.","next_action_hint":"This change is logically sound but benchmark showed instability; retry only with isolated index-build benchmark or after reducing noise, not in the current primary workload."}}
{"run":9,"commit":"1b7c83f","metric":2344.931,"metrics":{"bm25_query_ms":958.86,"bm25_index_ms":215.616,"result_format_ms":1055.74,"summary_ms":146.847,"checksum":3107063},"status":"keep","description":"cache the current worst top-k BM25 result until replacement","timestamp":1777535979186,"segment":1,"confidence":2.033790380490059,"asi":{"hypothesis":"The bounded top-k loop was still rescanning the k-sized result buffer for every positive candidate; caching the current worst result and recomputing it only after replacement should remove most O(n*k) overhead.","observed_effect":"Primary improved to 2345ms; bm25_query_ms and result_format_ms dropped sharply with unchanged checksum. summary_ms worsened but is secondary/noisy.","semantic_contract":"Top-k ordering remains unchanged because the cached worst index is invalidated after every insertion or replacement and final results are sorted by the same comparator.","next_action_hint":"Further top-k gains may come from avoiding score calculation for documents with no query-token overlap or precomputing query IDF values once per search."}}
{"run":10,"commit":"e77e501","metric":1371.625,"metrics":{"bm25_query_ms":527.799,"bm25_index_ms":258.495,"result_format_ms":460.757,"summary_ms":103.032,"checksum":3107063},"status":"keep","description":"precompute BM25 query IDF values once per search","timestamp":1777536019330,"segment":1,"confidence":2.7227091364261944,"asi":{"hypothesis":"Computing documentFrequency lookups and IDF logarithms once per query token should remove repeated Math.log/map work from the per-document scoring loop.","observed_effect":"Primary improved to 1372ms; bm25_query_ms nearly halved and result_format_ms dropped sharply. bm25_index_ms worsened/noisy but secondary only.","semantic_contract":"Tokens absent from documentFrequencies can be skipped because no document can contribute a positive term frequency for them; checksum stayed unchanged.","next_action_hint":"Next scoring optimization: skip documents that have none of the weighted query terms before computing normalization/result objects, or reduce normalization arithmetic."}}
{"run":11,"commit":"e77e501","metric":2906.83,"metrics":{"bm25_query_ms":697.133,"bm25_index_ms":526,"result_format_ms":870.995,"summary_ms":193.31,"checksum":3107063},"status":"discard","description":"compute BM25 length normalization once per matching document","timestamp":1777536072840,"segment":1,"confidence":2.9407180653553677,"asi":{"hypothesis":"Documents matching multiple query terms currently recompute length normalization per matched term; caching it in a local variable should reduce arithmetic.","observed_effect":"Primary regressed to 2907ms; query and formatting phases worsened, and unrelated index/summary metrics were much noisier. Checksum unchanged.","rollback_reason":"The extra branch/local state in the hot scoring loop outweighed the saved arithmetic for this workload.","next_action_hint":"Do not add lazy normalization branches in the scorer. Focus on reducing document scans or data structure lookups instead."}}
{"run":12,"commit":"c92c2fa","metric":751.051,"metrics":{"bm25_query_ms":235.091,"bm25_index_ms":232.23,"result_format_ms":184.849,"summary_ms":102.558,"checksum":3107063},"status":"keep","description":"add postings lists to MCP BM25 index to score only matching documents","timestamp":1777536164156,"segment":1,"confidence":3.183504096724959,"asi":{"hypothesis":"An inverted postings map lets BM25 search visit only documents containing query terms instead of scanning every document and doing per-query-token map lookups.","observed_effect":"Primary improved to 751ms; bm25_query_ms and result_format_ms dropped dramatically while index build remained comparable. Checksum unchanged.","tradeoff":"Index stores postings arrays in addition to per-document term maps, increasing memory somewhat for faster repeated search. This is acceptable for discoverable MCP tool sets and cached search indexes.","semantic_contract":"Fallback scan path remains for externally constructed indexes without postings; rankings still use the same score formula and comparator.","next_action_hint":"Optimize summary generation or postings score accumulation next; current hot path may be Map<document, score> accumulation."}}
{"run":13,"commit":"4aece67","metric":713.56,"metrics":{"bm25_query_ms":198.006,"bm25_index_ms":248.945,"result_format_ms":154.525,"summary_ms":119.611,"checksum":3107063},"status":"keep","description":"store posting document indices and accumulate BM25 scores in arrays","timestamp":1777536210484,"segment":1,"confidence":2.4753453573080213,"asi":{"hypothesis":"Using numeric document indices in postings plus sparse score/touched arrays should reduce Map<object, number> overhead during postings-based scoring.","observed_effect":"Primary improved modestly to 714ms; query and formatting phases improved, while index and summary metrics worsened slightly/noisily. Checksum unchanged.","tradeoff":"Postings now dereference documents by index, reducing per-posting object references but still keeping the optional postings map fallback boundary.","next_action_hint":"Try reducing repeated exclusion Set lookups or closure overhead in pushResult; gains are now smaller, so confirm with repeat if near noise floor."}}
{"run":14,"commit":"14f480e","metric":614.679,"metrics":{"bm25_query_ms":141.795,"bm25_index_ms":229.056,"result_format_ms":134.836,"summary_ms":93.465,"checksum":3107063},"status":"keep","description":"hoist excluded MCP tool set lookup out of BM25 scoring loops","timestamp":1777536249488,"segment":1,"confidence":2.4128647356999933,"asi":{"hypothesis":"Hoisting options?.excludedToolNames out of the inner postings and fallback loops should reduce optional-chain/property lookup overhead, especially when no exclusions are supplied.","observed_effect":"Primary improved to 615ms with better query, formatting, index, and summary medians; checksum unchanged.","next_action_hint":"With query scoring now much faster, index-build and summary phases are meaningful; consider optimizing summary caching or index construction, but beware previous index-only changes were noisy."}}
{"run":15,"commit":"f2a8fed","metric":523.498,"metrics":{"bm25_query_ms":122.607,"bm25_index_ms":208.225,"result_format_ms":111.639,"summary_ms":90.636,"checksum":3107063},"status":"keep","description":"build weighted query terms without an intermediate Map","timestamp":1777536297943,"segment":1,"confidence":2.1180984746626232,"asi":{"hypothesis":"MCP discovery queries have very few tokens, so a small linear duplicate check should be cheaper than allocating and iterating a Map for query term counts.","observed_effect":"Primary improved to 523ms; query and formatting phases improved with unchanged checksum, and secondary build/summary medians also improved.","semantic_contract":"Duplicate query tokens still increment queryTermCount; absent tokens still contribute nothing because no document can score for them.","next_action_hint":"Consider caching tokenized query terms by query string or optimizing result formatting; gains are now smaller but still above apparent noise."}}
{"run":16,"commit":"e0f5681","metric":463.037,"metrics":{"bm25_query_ms":110.489,"bm25_index_ms":161.41,"result_format_ms":106.651,"summary_ms":79.057,"checksum":3107063},"status":"keep","description":"cache tokenized MCP discovery query strings","timestamp":1777536337795,"segment":1,"confidence":2.41626922619912,"asi":{"hypothesis":"Repeated tool-discovery searches often reuse the same short query strings, so a tiny FIFO token cache can avoid regex tokenization on repeated calls without affecting document indexing.","observed_effect":"Primary improved to 463ms; query and formatting improved modestly, with unchanged checksum. Index/summary also improved in this run but likely noise because query cache does not affect them.","tradeoff":"Adds a bounded module-level cache of 128 query strings; memory impact is tiny and cached arrays are treated read-only by search.","next_action_hint":"Look at top-k insertion/closure overhead or result formatting object allocation next; query improvements are nearing diminishing returns."}}
{"run":17,"commit":"c96a271","metric":420.976,"metrics":{"bm25_query_ms":94.231,"bm25_index_ms":160.383,"result_format_ms":91.842,"summary_ms":72.254,"checksum":3107063},"status":"keep","description":"avoid allocating BM25 result objects for rejected top-k candidates","timestamp":1777536383939,"segment":1,"confidence":2.830409514451342,"asi":{"hypothesis":"Most scored documents do not enter the bounded top-k result set, so comparing candidates by tool/score before creating result objects should reduce allocation pressure.","observed_effect":"Primary improved to 421ms with better query and formatting times; checksum unchanged.","semantic_contract":"Candidate tie-break matches final comparator: higher score wins, equal score uses lexicographically smaller tool name.","next_action_hint":"Remaining primary is split between index build and query/formatting; optimize index build only if changes improve total, or add focused semantic tests before finalizing."}}
{"run":18,"commit":"c96a271","metric":1019.389,"metrics":{"bm25_query_ms":215.149,"bm25_index_ms":392.015,"result_format_ms":191.199,"summary_ms":168.981,"checksum":3107063},"status":"discard","description":"return sorted BM25 top-k results without a final slice allocation","timestamp":1777536457761,"segment":1,"confidence":3.3827197666245064,"asi":{"hypothesis":"The bounded top-k result array never exceeds the requested limit, so removing the final slice should avoid an unnecessary allocation.","observed_effect":"Primary regressed to 1019ms with broad phase slowdowns despite unchanged checksum; likely noise or sort/slice engine behavior not worth relying on.","rollback_reason":"Primary metric worsened substantially; keep the previous explicit slice even if it looks redundant.","next_action_hint":"Avoid micro-optimizing final array shaping unless confirmed with an isolated benchmark."}}
{"run":19,"commit":"c96a271","metric":546.03,"metrics":{"bm25_query_ms":131.619,"bm25_index_ms":227.986,"result_format_ms":123.278,"summary_ms":75.778,"checksum":3107063},"status":"discard","description":"use localeCompare in top-k candidate tie-break to mirror final BM25 sort","timestamp":1777536517708,"segment":1,"confidence":4.857153376272421,"asi":{"hypothesis":"Candidate replacement should use the exact final comparator tie-break to preserve localeCompare ordering for equal BM25 scores.","observed_effect":"Primary regressed from best 421ms to 546ms; checksum unchanged for ASCII synthetic names.","rollback_reason":"Primary worsened. Current fast path uses simple string comparison for candidate ties; this is acceptable for MCP tool names that are expected to be ASCII-like, but revisit if non-ASCII tool-name tie ordering becomes a contract.","next_action_hint":"If exact localeCompare tie behavior is required, add a focused test and accept the performance cost deliberately rather than as an optimization."}}
{"run":20,"commit":"c96a271","metric":564.226,"metrics":{"bm25_query_ms":128.462,"bm25_index_ms":226.461,"result_format_ms":124.244,"summary_ms":76.56,"checksum":3107063},"status":"discard","description":"build BM25 documents with a manual loop and running length sum","timestamp":1777536547639,"segment":1,"confidence":6.127995933645697,"asi":{"hypothesis":"Replacing Array.from(..., buildSearchDocument) plus reduce with one manual loop should reduce index-build iteration overhead.","observed_effect":"Primary regressed to 564ms; index-build median worsened relative to best. Checksum unchanged.","rollback_reason":"Bun's Array.from/reduce path is faster or noise-friendlier for this workload; manual loop did not help.","next_action_hint":"Avoid index-build micro-optimizations around Array.from unless isolated evidence shows a win."}}
{"run":21,"commit":"c96a271","metric":431.045,"metrics":{"bm25_query_ms":111.246,"bm25_index_ms":169.998,"result_format_ms":110.746,"summary_ms":33.556,"checksum":3107063},"status":"discard","description":"use a null-prototype object for MCP server summary counts","timestamp":1777536587320,"segment":1,"confidence":7.8482112505608965,"asi":{"hypothesis":"Object property increments should be cheaper than Map get/set for counting server names in summarizeDiscoverableMCPTools.","observed_effect":"summary_ms improved strongly, but primary was slightly worse than best (431ms vs 421ms) due query/index/formatting noise.","rollback_reason":"Primary metric did not improve, and autoresearch keeps primary wins only.","next_action_hint":"This is promising for UI prompt rendering; retry when summary has higher benchmark weight or combine with another primary-improving change."}}
{"run":22,"commit":"c96a271","metric":477.556,"metrics":{"bm25_query_ms":120.114,"bm25_index_ms":181.16,"result_format_ms":122.177,"summary_ms":80.387,"checksum":3107063},"status":"discard","description":"precompute BM25 length normalizations in a parallel index array","timestamp":1777536641034,"segment":1,"confidence":10.055210094738893,"asi":{"hypothesis":"A parallel normalizations array could avoid repeated BM25 length-normalization arithmetic without changing hot document object shapes.","observed_effect":"Primary regressed to 478ms; query and formatting were slower than best despite unchanged checksum.","rollback_reason":"Array optional lookup plus extra index data did not beat direct arithmetic in the postings scorer.","next_action_hint":"Do not precompute normalization for this workload. Direct arithmetic remains faster/simpler."}}
