{"run":23,"commit":"c96a271","metric":433.924,"metrics":{"bm25_query_ms":102.239,"bm25_index_ms":161.169,"result_format_ms":98.576,"summary_ms":71.084,"checksum":3107063},"status":"discard","description":"avoid tokenize filter callback by checking normalized string before split","timestamp":1777536682107,"segment":1,"confidence":14.429254451479034,"asi":{"hypothesis":"After trim, non-empty tokenized strings should not produce empty split tokens, so replacing split().filter() with a normalized-string guard should reduce callback/allocation overhead.","observed_effect":"Primary was slightly worse than best (434ms vs 421ms) despite some secondary phase medians looking good; checksum unchanged.","rollback_reason":"No primary improvement; keep the simpler existing tokenize pipeline for now.","next_action_hint":"Tokenization micro-optimizations are near noise floor. Move to validation/tests or a different workload."}}
{"run":24,"commit":"c96a271","metric":449.31,"metrics":{"bm25_query_ms":104.437,"bm25_index_ms":161.858,"result_format_ms":105.307,"summary_ms":75.701,"checksum":3107063},"status":"discard","description":"noise calibration rerun of current best without code changes","timestamp":1777536709801,"segment":1,"confidence":15.400682407169617,"asi":{"hypothesis":"Rerunning the current best without code changes estimates benchmark noise after many near-threshold micro-optimizations.","observed_effect":"No-op rerun measured 449ms vs best 421ms, confirming roughly tens of milliseconds of run-to-run noise on this Windows setup.","rollback_reason":"No code change and no primary improvement to keep.","next_action_hint":"Require clear wins greater than about 30ms before keeping further micro-optimizations, or shift to correctness/tests/finalization."}}
{"run":25,"commit":"c96a271","metric":457.547,"metrics":{"bm25_query_ms":105.656,"bm25_index_ms":168.505,"result_format_ms":102.536,"summary_ms":75.97,"checksum":3107063},"status":"discard","description":"cache weighted BM25 query terms per search index","timestamp":1777536766416,"segment":1,"confidence":16.34408084526486,"asi":{"hypothesis":"Caching per-index weighted query terms should avoid repeated document-frequency lookups and IDF math for repeated queries against the same search index.","observed_effect":"Primary regressed to 458ms; query/formatting were not better than current best, so cache overhead/WeakMap lookup offset savings. Checksum unchanged.","rollback_reason":"No primary improvement and adds cache invalidation complexity for mutable external indexes.","next_action_hint":"Do not add weighted-query cache. The existing token cache is enough; scoring and index build dominate."}}
{"run":26,"commit":"c96a271","metric":459.154,"metrics":{"bm25_query_ms":116.493,"bm25_index_ms":196.853,"result_format_ms":114.029,"summary_ms":38.002,"checksum":3107063},"status":"discard","description":"optimize MCP server summary counting with a null-prototype object and manual result array","timestamp":1777536974375,"segment":1,"confidence":19.934155028385174,"asi":{"hypothesis":"Server names are strings, so null-prototype object counts plus Object.keys/manual array construction should reduce summary rendering overhead versus Map entries/sort/map.","observed_effect":"summary_ms improved from recent ~70-90ms range to 38ms, but total_ms regressed versus best 420.976ms because query/index/formatting medians were noisier/slower in this run.","rollback_reason":"Primary metric did not improve, despite a real-looking summary win. Autoresearch primary metric is total_ms, so revert this summary-only optimization for this segment.","next_action_hint":"Keep this idea for a summary/UI-description focused segment or combine only with a clear query-path win; do not retry summary-only changes under the current primary metric."}}
{"run":27,"commit":"37f272e","metric":348.204,"metrics":{"bm25_query_ms":51.872,"bm25_index_ms":168.627,"result_format_ms":55.497,"summary_ms":71.747,"checksum":3107063},"status":"keep","description":"reuse postings BM25 score and touched-index scratch buffers per search index","timestamp":1777537072695,"segment":1,"confidence":25.541130727425212,"asi":{"hypothesis":"Postings search still allocated a sparse score array and touched-index array on every query; reusing scratch buffers on the cached search index should reduce repeated allocation and GC without changing scoring.","observed_effect":"Primary improved from best ~421ms to 348ms; bm25_query_ms and result_format_ms roughly halved, checksum unchanged.","semantic_contract":"Scratch scores are reset for every touched document before returning; BM25 contributions are positive, so zero remains a safe untouched sentinel. Fallback indexes without postings still use the existing scan path.","tradeoff":"Search mutates internal scratch fields on the index object. This is synchronous and per-index, but concurrent/reentrant use of the same index would need care if introduced later.","next_action_hint":"Consider a focused type/test pass for postings fallback and scratch reset behavior before more risky micro-optimizations."}}
{"run":28,"commit":"e7e9d74","metric":344.726,"metrics":{"bm25_query_ms":47.984,"bm25_index_ms":171.507,"result_format_ms":52.764,"summary_ms":73.943,"checksum":3107063},"status":"keep","description":"split postings BM25 scoring into excluded and non-excluded hot paths","timestamp":1777537160324,"segment":1,"confidence":28.440190865712335,"asi":{"hypothesis":"Most internal benchmark and many discovery searches have no excluded tool set; branching once outside the postings loop should avoid an optional-chain Set lookup on every posting while preserving the exclusion path for selected tools.","observed_effect":"Primary improved marginally from 348.204ms to 344.726ms; bm25_query_ms and result_format_ms improved slightly, checksum unchanged. The gain is small relative to prior noise and should be treated cautiously.","semantic_contract":"When exclusions are present, the existing Set membership check remains in a separate path. When absent, behavior is equivalent because no tool names need filtering.","tradeoff":"Adds duplicated postings scoring loop code for a very small measured improvement; revisit if maintainability becomes a concern.","next_action_hint":"Rerun this exact state or prioritize less noisy/index-build optimizations before further micro-optimizing the query loop."}}
{"run":29,"commit":"e7e9d74","metric":355.439,"metrics":{"bm25_query_ms":62.711,"bm25_index_ms":169.775,"result_format_ms":55.976,"summary_ms":72.381,"checksum":3107063},"status":"discard","description":"store document length on each BM25 posting to avoid document lookup in scoring","timestamp":1777537228852,"segment":1,"confidence":25.1235006021678,"asi":{"hypothesis":"Including documentLength in each posting would let the non-excluded hot path compute BM25 normalization without fetching the search document object for every posting.","observed_effect":"Primary regressed from best 344.726ms to 355.439ms; bm25_query_ms worsened, while result_format_ms remained similar and checksum unchanged.","rollback_reason":"Larger posting objects and extra memory traffic outweighed the saved document lookup.","next_action_hint":"Keep postings compact; do not duplicate per-document fields in each posting. If optimizing this area, use parallel per-document arrays rather than bloating postings."}}
{"run":30,"commit":"e7e9d74","metric":362.293,"metrics":{"bm25_query_ms":45.707,"bm25_index_ms":174.61,"result_format_ms":49.411,"summary_ms":82.434,"checksum":3107063},"status":"discard","description":"replace postings for-of destructuring with index-based loops","timestamp":1777537297685,"segment":1,"confidence":24.14714552497955,"asi":{"hypothesis":"Index-based loops over postings arrays should avoid iterator/destructuring overhead in the hot BM25 scoring path while preserving scoring semantics.","observed_effect":"Query and result-format phases improved slightly, but total_ms regressed to 362ms because index and summary medians worsened; checksum unchanged.","rollback_reason":"Primary metric worsened relative to best 344.726ms. The small hot-loop gain was not enough to overcome full-workload noise/regression.","next_action_hint":"If revisiting, benchmark query-only or combine with an index/summary improvement; otherwise keep simpler for-of destructuring."}}
{"run":31,"commit":"1cdfd23","metric":332.317,"metrics":{"bm25_query_ms":33.978,"bm25_index_ms":170.581,"result_format_ms":41.696,"summary_ms":78.345,"checksum":3107063},"status":"keep","description":"reuse a typed touched-index scratch buffer for postings BM25 scoring","timestamp":1777537396871,"segment":1,"confidence":24.69217853938539,"asi":{"hypothesis":"The reused JS touched-index array still mutates length and uses push for every newly touched document; a fixed Int32Array plus local touchedCount should reduce dynamic array overhead in repeated postings searches.","observed_effect":"Primary improved from best 344.726ms to 332.317ms; bm25_query_ms and result_format_ms improved materially, checksum unchanged.","semantic_contract":"Touched indices are read only from 0..touchedCount each query. Score scratch entries are still reset for every touched document, so stale Int32Array contents beyond touchedCount are ignored.","tradeoff":"Adds a fixed Int32Array of document count per cached index, which is small compared with postings and score scratch.","next_action_hint":"Consider confirming with a rerun because the improvement is above recent query-loop changes but still within a noisy sub-20ms range."}}
{"run":32,"commit":"c082d9d","metric":325.414,"metrics":{"bm25_query_ms":35.204,"bm25_index_ms":177.902,"result_format_ms":43.744,"summary_ms":75.928,"checksum":3107063},"status":"keep","description":"precompute BM25 query weight factor for postings scoring","timestamp":1777537466376,"segment":1,"confidence":25.7622477007803,"asi":{"hypothesis":"The postings scorer still multiplied queryTermCount, idf, and BM25_K1+1 for every posting; precomputing a per-query-token weight should remove repeated multiplication in both postings and fallback scoring.","observed_effect":"Primary improved from best 332.317ms to 325.414ms. Query time was similar/slightly noisier but total improved; checksum stayed unchanged.","semantic_contract":"Duplicate query tokens still increment queryTermCount by increasing the precomputed weight with the same idf factor, so BM25 scoring remains equivalent.","tradeoff":"Weighted query term objects gain one numeric field, but they are tiny and per-query; no index memory increase.","next_action_hint":"Further improvements are near noise; consider a confirmation rerun or move to correctness tests around postings, exclusions, and duplicate query terms."}}
{"run":33,"commit":"c082d9d","metric":436.43,"metrics":{"bm25_query_ms":39.363,"bm25_index_ms":241.958,"result_format_ms":59.744,"summary_ms":95.364,"checksum":3107063},"status":"discard","description":"cache tokenization for short MCP tool metadata fields during BM25 index build","timestamp":1777537536814,"segment":1,"confidence":26.88631670222597,"asi":{"hypothesis":"Many MCP metadata fields are short and repeated (schema keys, labels, server names), so caching tokenized short strings during index construction could reduce repeated regex tokenization without changing BM25 semantics.","observed_effect":"Primary regressed to 436.43ms; bm25_index_ms worsened substantially and summary also worsened, while checksum stayed unchanged.","rollback_reason":"The extra cache lookups/maintenance outweighed tokenization reuse for this workload, especially with many unique short values or Map overhead in index build.","next_action_hint":"Do not use a broad short-string token cache. If tokenization is revisited, target specific repeated schema keys with a narrower cache or benchmark index-build in isolation."}}
{"run":34,"commit":"c082d9d","metric":453.751,"metrics":{"bm25_query_ms":43.172,"bm25_index_ms":239.364,"result_format_ms":55.79,"summary_ms":110.13,"checksum":3107063},"status":"discard","description":"store BM25 postings as parallel document-index and term-frequency arrays","timestamp":1777537627248,"segment":1,"confidence":31.693582281758236,"asi":{"hypothesis":"Parallel posting arrays should reduce posting object allocation/property access and improve cache locality in the BM25 postings scorer.","observed_effect":"Primary regressed to 453.751ms; query path remained decent but index build and summary medians worsened substantially. Checksum unchanged.","rollback_reason":"Changing postings to parallel arrays increased build/memory overhead enough to lose on total latency. The current object postings are better for this workload.","next_action_hint":"Do not refactor postings storage further unless the benchmark target weights query-only latency and index build is amortized."}}
{"run":35,"commit":"c082d9d","metric":326.256,"metrics":{"bm25_query_ms":33.553,"bm25_index_ms":172.4,"result_format_ms":42.145,"summary_ms":79.722,"checksum":3107063},"status":"discard","description":"confirmation rerun of current BM25 query-weight optimization state","timestamp":1777537664323,"segment":1,"confidence":35.481517729428596,"asi":{"hypothesis":"Because recent query-loop changes are near the benchmark noise floor, rerunning the current best without code changes should confirm whether the 325ms result is stable before attempting more micro-optimizations.","observed_effect":"No-code rerun measured 326.256ms, within ~0.3% of the current best 325.414ms; bm25_query_ms and result_format_ms stayed in the same range and checksum was unchanged.","rollback_reason":"No code change and primary did not improve over the current best.","next_action_hint":"Treat the current best as stable. Future iterations should avoid tiny query-loop micro-optimizations unless expected to save more than several milliseconds; consider focused correctness tests or a different workload/segment."}}
{"run":36,"commit":"08008fc","metric":321.564,"metrics":{"bm25_query_ms":38.52,"bm25_index_ms":185.867,"result_format_ms":48.605,"summary_ms":37.563,"checksum":3107063},"status":"keep","description":"use null-prototype counting and manual array construction for MCP server summaries","timestamp":1777537731273,"segment":1,"confidence":35.79480174539936,"asi":{"hypothesis":"Although earlier summary-only attempts were noisy, summary generation is now a large fraction of the stabilized workload; counting server names with a null-prototype object and manual result array should reduce UI/tool-discovery description overhead.","observed_effect":"Primary improved modestly from best 325.414ms to 321.564ms. summary_ms dropped strongly to 37.563ms, while bm25_index_ms/query/formatting were worse than the previous best, so total gain is small and should be treated cautiously.","semantic_contract":"Output remains sorted by server name with the same {name, toolCount} shape and total tool count; checksum unchanged.","tradeoff":"Uses string-keyed object counting instead of Map. This is appropriate for serverName strings but less general if arbitrary prototype-sensitive keys were ever allowed.","next_action_hint":"Rerun current state to confirm the small primary gain before layering more changes; if noisy, this may still be valuable for UI-description latency even if total_ms fluctuates."}}
{"run":37,"commit":"9891464","metric":289.682,"metrics":{"bm25_query_ms":40.665,"bm25_index_ms":163.522,"result_format_ms":47.102,"summary_ms":37.928,"checksum":3107063},"status":"keep","description":"confirmation rerun of current summary-optimized BM25 tool-discovery state","timestamp":1777537789421,"segment":1,"confidence":36.32758567931457,"asi":{"hypothesis":"Because the previous summary optimization produced a small primary win, rerunning the same code should confirm whether the improvement is stable rather than a one-off noisy measurement.","observed_effect":"No-code confirmation run measured 289.682ms, substantially better than the prior 321.564ms best. Summary stayed low and checksum was unchanged, suggesting the current state is stable and possibly benefited from warmer runtime/cache effects.","semantic_contract":"No source behavior changed in this iteration; this run only confirms the currently kept code state.","tradeoff":"Metric improvement is from rerun/noise or warm-cache effects, not a new code change. Treat this as confidence in the existing kept summary/BM25 optimizations rather than a separate implementation win.","next_action_hint":"Use 289.682ms as a confirmed lower bound for current-state performance, but require actual code changes for future keeps unless another rerun is intentionally calibrating noise."}}
{"run":38,"commit":"9891464","metric":304.106,"metrics":{"bm25_query_ms":44.301,"bm25_index_ms":173.694,"result_format_ms":50.266,"summary_ms":46.871,"checksum":3107063},"status":"discard","description":"cache tokenization only for MCP schema keys during BM25 index build","timestamp":1777537861567,"segment":1,"confidence":36.02744880850321,"asi":{"hypothesis":"A broad short-string token cache regressed, but schema property keys are heavily repeated across MCP tools; caching tokenized schema keys only should reduce repeated regex tokenization during BM25 index construction with lower cache overhead.","observed_effect":"Primary measured 304.106ms, worse than the confirmed best 289.682ms. bm25_index_ms did not improve enough and query/formatting/summary medians were also slower; checksum unchanged.","rollback_reason":"Schema-key cache adds Map lookup and eviction overhead without a primary win in the full workload.","next_action_hint":"Do not pursue tokenization caches for index build under this benchmark. Remaining viable paths are likely correctness validation, a new native/TUI segment, or larger algorithmic changes rather than micro-caches."}}
{"run":39,"commit":"9891464","metric":320.759,"metrics":{"bm25_query_ms":46.561,"bm25_index_ms":194.459,"result_format_ms":56.88,"summary_ms":39.815,"checksum":3107063},"status":"discard","description":"derive BM25 document frequencies from postings lengths after index construction","timestamp":1777537937950,"segment":1,"confidence":35.732230733344366,"asi":{"hypothesis":"Because each postings list has one entry per document containing that token, document frequency can be derived from postings.length after construction, avoiding a documentFrequencies get/set on every per-document token during index build.","observed_effect":"Primary regressed to 320.759ms versus best 289.682ms, and bm25_index_ms worsened rather than improving. Checksum unchanged, so semantics were preserved.","rollback_reason":"The extra postings pass and Map writes after construction cost more than the incremental get/set in the existing build loop for this workload.","next_action_hint":"Keep document-frequency maintenance inline with postings construction. Further index-build optimizations need a different approach than post-pass derivation."}}
{"run":40,"commit":"9891464","metric":932.238,"metrics":{"bm25_query_ms":94.258,"bm25_index_ms":631.519,"result_format_ms":103.127,"summary_ms":89.535,"checksum":3107063},"status":"discard","description":"remove unused queryTermCount field from weighted BM25 query terms","timestamp":1777538017177,"segment":1,"confidence":35.10812099615186,"asi":{"hypothesis":"After precomputing BM25 query weight, queryTermCount is no longer used for scoring; removing it from weighted query term objects should reduce per-query object writes and hidden-class size while preserving duplicate-token semantics via weight accumulation.","observed_effect":"Primary regressed severely to 932.238ms, with bm25_index_ms unexpectedly high and query/formatting also slower. Checksum unchanged, so semantics were preserved but performance worsened/noisy.","rollback_reason":"Despite being logically simpler, changing the query term object shape hurt hot-path performance or coincided with severe runtime noise. Revert and keep the existing object shape.","next_action_hint":"Avoid small weighted-query object-shape tweaks. If pursuing further, use confirmation reruns or larger algorithmic changes rather than hidden-class micro-edits."}}
{"run":41,"commit":"9891464","metric":898.789,"metrics":{"bm25_query_ms":85.383,"bm25_index_ms":559.48,"result_format_ms":105.02,"summary_ms":106.913,"checksum":3107063},"status":"discard","description":"skip camelCase tokenization regex when MCP metadata has no uppercase letters","timestamp":1777538083064,"segment":1,"confidence":34.505438771135644,"asi":{"hypothesis":"Most MCP metadata strings in the workload are lowercase/underscore/hyphen separated, so checking for uppercase first should avoid the camelCase boundary replace regex during tokenization and speed BM25 index build without changing token output.","observed_effect":"Primary regressed badly to 898.789ms; bm25_index_ms rose to 559.48ms and query/formatting/summary also worsened. Checksum unchanged, so token semantics matched the benchmark.","rollback_reason":"The extra uppercase test and hoisted regex constants hurt Bun's optimized replace pipeline or triggered unfavorable runtime behavior; no primary improvement.","next_action_hint":"Do not add preflight regex checks to tokenize. Keep the original chained regex pipeline unless a much more targeted tokenizer change is proven in isolation."}}
